,comment,author,date,like,type
0,정찬성:묵묵하고 든든한 팀의수장이자 정신적 지주<br>하승진:피지컬 넘사 팩폭 및 치명적인 멘트딜러<br>인일권:적당한 전투력과 조화를 중요시 하는 분위기 메이커<br>문호:팀의 실질적인 행동대장 중2병 치료 및 갱생담당,stark tony,2022-02-03T17:26:46Z,2842,main-comment
1,자기보다 약한사람만 건드렸다는데 애기들이랑 노인분들만 건들이신건가,Korean Jaeho,2022-02-06T07:53:19Z,331,main-comment
2,정찬성 선수 웃는게 여유가 느껴진다 ㅋㅋㅋㅋ<br>왜케 매력적이시지,지나가는 행인3,2022-02-05T18:21:42Z,306,main-comment
3,"근데 정찬성선수 말하는 스타일이 정말 매너있고 상대감으로 부터 반발감을 없애는 따뜻하면서도 뭔가 지적을 해주는... 나중 은퇴 후, 격투짐을 운영하시며 소년원 상담가로 나서셔도 좋으실 것 같네요.",G reiyoda,2022-02-05T14:09:55Z,518,main-comment
4,첫 스파링때부터 허벌나게 재밋네ㅋㅋㅋ진짜 얼마나 약한사람들을 때리고다녓던거냐 저 귀엽고 깜찍한 냥냥펀지로ㅋㅋㅋㅋ일자로 쭉 뻗어야지 손이 휘네ㅋㅋㅋㅋ이 채널보시는분들께선 약한사람 괴롭히거나 때리지마세요~,혼찌 honzzi,2022-02-06T10:13:37Z,44,main-comment
5,"와 이거 진짜 창의적이다. 보통 일반인이었으면, 잔인하단 말 나오는데, 양아치나 범죄자같은 비양심적인 애들 모아서 참교육도 대신 해주면서 통쾌함 얻게 해주는 컨텐츠.......그리고 하승진? 님이 계속 너한테 맞았던 애들 생각해보라고 하는 거. 진짜. ㅋㅋㅋ",Ho Park,2022-02-03T10:59:30Z,4841,main-comment
6,편집자님이 금손인거다. 이런거 대본 없이 가면 중간중간 엄청 루즈해지고 재미없어지는데 대본 있는 거 처럼 보일 정도면 편집자가 다 한거.,Coney J,2022-02-05T12:37:32Z,168,main-comment
7,진짜 승진이형님 옆에서 도발하시는거 너무좋다,안효진,2022-02-05T19:40:22Z,175,main-comment
8,체급이 안맞긴한데 코좀짐에 경량급 최한길선수 나와서 착한길로 안내해주는 테마도 재밌을듯해요ㅋㅋㅋ,klkiko,2022-02-05T14:04:25Z,150,main-comment
9,건강한 스포츠 정신을 알릴 수 있는 분명한 취지의 좋은 컨텐츠인것 같습니다 <br>1화도 그렇고 스파링부턴 정말 집중해서 봤네요 3분이 이렇게 길었나 짜릿짜릿 ㅋㅋㅋㅋㅋㅋㅋㅋ,퀄님,2022-02-05T17:50:06Z,23,main-comment
10,정찬성은 교도소나 소년원 심리상담사 해도 될듯ㅋㅋ,김덕배,2022-02-06T01:57:15Z,58,main-comment
11,진짜 이거보고 파이트클럽 참가자들이 얼마나 잘 싸우는 건지 알게됨,몰라도왠진,2022-02-06T02:52:45Z,90,main-comment
12,이 영상보니 쾌감을 느끼네요!<br>세상을 너무 만만하게 보는 양아치.<br>약해보인다고 괴롭히는 허세인들.<br>문신충 퇘랑이들..까불이등등 ..<br>많이 참여해서 새롭게 태어놨으면 좋겠네요,카사노바,2022-02-06T13:34:03Z,17,main-comment
13,ㅋㅋㅋㅋㅋㅋㅋㅋ하승진 넌 오늘부터 팬이다ㅋㅋㅋㅋㅋㅋㅋㅋㅋㅋㅋㅋㅋㅋㅋㅋ자존심 종.나패넼ㅋㅋㅋㅋㅋㅋㅋㅋㅋㅋㅋㅋㅋㅋ계속 웃기려고 하는데 드립 하나도 안 받아주고 ㅋㅋㅋㅋㅋㅋㅋㅋㅋㅋㅋㅋ따봉,시미켄,2022-02-05T14:50:43Z,159,main-comment
14,이번엔 문호님이 웃음기없이 해줘서 너무 좋았음 제대로된 참교육한 느낌이라서,피킨 PIKIN,2022-02-03T13:33:11Z,1123,main-comment
15,대본없이 리얼로가고 섭외도너무좋네요<br>진짜 잘봤습니다ㅈ계속 기대되네요,이경열,2022-02-05T13:52:55Z,61,main-comment
16,"<a href=""https://www.youtube.com/watch?v=hRPqJfo483c&amp;t=26m10s"">26:10</a>  문호님 웃으면서 등짝 콩펀치 개귀엽닼ㅋㅋㅋ",G ongmin공민,2022-02-07T04:24:20Z,10,main-comment
17,구성 장소 컨텐츠 케릭터 모든것이 완벽하다,푸름영어,2022-02-05T15:32:09Z,16,main-comment
18,문호님도 넘사벽이신데 문호보다 더 강한 코리안좀비 그는 도덕책 ..,연우는곧휴가철,2022-02-05T14:54:53Z,54,main-comment
19,싸움 잘하고 못하고를 떠나서 아직 충분히 젊고 갱생할수 있는 나이인데도 불고하고 본인 스스로가 범죄자자라고 자신을 치부하며 떳떳하게 방송에서 떠들어대며 드립치는 모습이 매우 안타깝고 유감스럽습니다,dazzling wing,2022-02-04T02:21:47Z,2181,main-comment
20,"칼리 아르니스(Kali Arnis). 필리핀의 전통무술이며 칼리(Kali), 아르니스(Arnis), 에스크리마(Eskrima, Escrima)로도 불린다.<br><br>주로 칼이나 짧은 봉을 사용하기 때문에 단순 무기술에 그치는 것으로 알고 있는 이들도 있지만, 군용무술 답게 엄연히 무기를 사용하지 않는 맨손 격투술도 포함된 무술이다. 오랜 세월에 걸쳐 발전해왔고 실전을 통해 증명되었기 때문에 20세기들어 그 실전성과 효용성을 인정받았다. 나이프 파이팅에서 중요한 자리를 차지하고 있으며 세계 여러 나라에서 호신술로서도 각광받고 있다.",깜장로또,2022-02-06T08:19:44Z,0,reply-comment
21,@양석원 운동선수가 사람 때리면 안돼요,네즈코,2022-02-06T06:51:25Z,0,reply-comment
22,@시민성 아직도 세상을 믿나? 허허허...,핑핑이,2022-02-06T06:30:21Z,1,reply-comment
23,애도 애대로 문제지만 쟤네 부모님은 뭐하는사람인지 집안환경이 어떤꼬라지인지도 궁금함 24살에 저렇게까지 막장으로 썩어버린정도면 분명 자라온 환경몫도 클터,포핀2,2022-02-06T06:05:44Z,1,reply-comment
24,"@핑핑이 검사커플, 한남더힐 주민 서강대 학생까지.. 멋진스펙이네요!,!",100억농협통장잔고,2022-02-06T05:59:44Z,0,reply-comment
25,약한사람만 때리고 다녓던거야... 팩폭 진짜 멋잇다 ㅠㅠㅠ하승진 팬됨,잼민이,2022-02-05T15:44:14Z,131,main-comment
26,승진이형 진짜 마음에 든다 옷 벗어주는 것도 스윗하고 살살 긁는 것도 좋고 ㅋㅋㅋㅋㅋ,사나이 황노현,2022-02-07T11:06:32Z,1,main-comment
27,자기가 안되는걸 알고 &quot;아 내가 센게 아니었구나&quot;를 깨닫고 나서 &quot;운동 배워야겠다&quot; 하는게 운동 배워서 진짜로 세진다음에 남을 패겠다는 걸로 보여서 진짜 충격이고 소름끼침..,이새침데기,2022-02-06T15:09:38Z,181,main-comment
28,ㅋㅋㅋㅋㅋㅋㅋ승진이형 너무좋다 승진이형은 진짜 팩트꽃는거보소 와 개좋다,강아,2022-02-06T09:27:19Z,4,main-comment
29,재미있으면서도 양아치들 섭외해서 어그로 끄는 방송인줄 알았는데 참교육도 해주고 교훈도 주고 진짜 멋있고 운동 배운 사람들은 함부로 까불지 않는다는 것도 알려주고 진짜 좋은 콘텐츠네요 ㅋㅋ,clio pesuto,2022-02-03T10:34:30Z,2607,main-comment
30,승진이형 멘트 잘 친다 타율도 높고ㅋㅋㅋㅋㅋ,김재민,2022-02-06T01:58:03Z,10,main-comment
31,보다보니까 문호님 팬됐네ㅋㅋㅋㅋㅋㅋㅋㅋㅋ 진짜 개무섭게 생기셨는데 그냥 강한 게 느껴지는 외모,밀가루,2022-02-05T16:46:06Z,32,main-comment
32,이 프로그램의 최대 수혜자는 문호님인 듯. 찰지게 스트레스 해소하면서 존재감 뿜뿜.,범근튜브,2022-02-07T06:03:15Z,1,main-comment
33,이 지역에 재능이 있지만 취미로 하는 사람들을 게스트로 모셔서 기회를 주고 도우며 발굴하는 컨텐츠면 좋겠네요,라 솔,2022-02-06T19:20:19Z,0,main-comment
34,문호형 진짜 찬성이형 옆에서 웃는모습만 봤을땐 그냥 순둥순둥한 착한형인줄알았는데 진지해진 모습 보니까 ㄹㅇ 저승사자 였었네... 일반인 입장에서 이런 사람들(프로들) 속에서 세계 최고 레벨인사람은 어느수준인지 감도안오네..,도전자,2022-02-03T10:30:36Z,2078,main-comment
35,씩씩한거 졸라찾더만 시작하자마자 힘들어서 졸라 씩씩거리네ㅋㅋㅋㅋㅋㅋㅋㅋ,horse J,2022-02-06T03:42:29Z,21,main-comment
36,"<a href=""https://www.youtube.com/watch?v=hRPqJfo483c&amp;t=24m00s"">24:00</a> 여기서 찬성이형 표정 진짜 개웃기네 행복해 보여",혈주,2022-02-06T06:12:42Z,50,main-comment
37,"<a href=""https://www.youtube.com/watch?v=hRPqJfo483c&amp;t=27m00s"">27:00</a> 프로그램 취지에 맞는 말이 나와 웃는 정찬성님",Ldjd,2022-02-06T01:47:14Z,50,main-comment
38,너무 흥미진진하고 긴장타면서 즐겁고 재미있게 보고 있습니다. 코로나때문에 힘든 시기에 스트레스도 풀리고 너무 좋습니다! 감사합니다! 쭈욱 잘 보겠습니다!,SWELLDOM TV,2022-02-07T16:33:01Z,0,main-comment
39,판사가 판결을 약하게 해주니까  전과가 자랑이라고.... 제발 처벌을 강화해주세요.,내편은 오직 가족뿐,2022-02-03T10:17:49Z,2132,main-comment
40,진짜 ㅈㄴ 좋은 컨텐츠다ㅋㅋㅋ 걍 전국구 양아치들 다 조져놓으면 안되나,유승우,2022-02-06T04:01:19Z,12,main-comment
41,문호행님 ㅋㅋㅋㅋㅋㅋㅋㅋㅋㅋㅋㅋ 다운시키고 복부만 웃으면서 때리시는데 ㅋㅋㅋㅋㅋㅋㅋㅋ 진짜 뉴비보는 고인물같닼ㅋㅋㅋㅋㅋㅋ,푸우,2022-02-07T03:39:13Z,0,main-comment
42,아니 파이터 찾는 컨텐츠가 양아치 참교육 컨텐츠가 되버렸네. <br>어떤 방향으로든 응원합니다.,Sungkeun Park,2022-02-06T14:44:30Z,2,main-comment
43,하승진님볼때 불안하긴한데 저런 캐릭터가 있어야 전체적으로 프로그램이 재밌고 정체성이 확실해지는거같습니다,개구리,2022-02-05T12:07:57Z,21,main-comment
44,하승진씨 1화 때부터 느꼈는데.. 큰 맘 먹고 나온 일반인 참가자들 살살 자극하면서 기죽였다가 자극했다가 고기 뒤집듯이 구워 삶아서 포기할 것도 못하게 만들어가지고 문호님한테 더 맞게 만들고 그렇게 맞아서 주눅 든 참가자들한테 또 팩트폭행한답시고 한마디 한마디 툭툭 꽂아서 자존심 묵사발 만들고 이러시던데 이러는 거 진짜 너무 보기 좋습니다 앞으로도 계속 그렇게 부탁해요 응원합니다,리플리,2022-02-03T14:23:27Z,3517,main-comment
45,봉봉 저 동네 자체가 20대초반 술집에 오피 유흥가임,췍스초코,2022-02-07T17:19:51Z,0,reply-comment
46,키220에 몸무게 150kg아님? 60키로대 멸치육수충들은 한손으로 목잡고 들어올릴 수 있을듯,Factos,2022-02-07T15:18:18Z,0,reply-comment
47,ㅋㅋ인정,신현준,2022-02-07T12:19:47Z,0,reply-comment
48,하승진같은 존재는 있어야함.<br>서장훈같은 존재,내얼굴,2022-02-07T08:50:50Z,0,reply-comment
49,원래 사람은 저렇게 자극 해야됨 그래야 더욱 더 성장하고 버릇고쳐짐,돌맹이,2022-02-07T06:36:33Z,0,reply-comment
50,마지막에 파닥파닥거리네~ㅋㅋㅋ 처음 맞고 머리 뒤로 제껴질때부터 정찬성님 표정: 예상했지만 어른이랑 한 초5학녕 정도 싸움인거 알고 이거 어쩌나.. 왠만하면 덜 다치고 정신은 차리게 문호가 적당히 해줘야 할텐데 하는 걱정하며 난처한 표정~ㅎㅎㅎ,신데렐라,2022-02-06T05:52:32Z,6,main-comment
51,"하승진도 순수 피지컬(키,덩치)은 원탑이다 보니까 옆에서 입딜 잘넣네 ㅋㅋㅋㅋ",Mason 76,2022-02-05T14:26:00Z,40,main-comment
52,찬성이형 입장에서 보면 얼마나 가소로울까,마마마마마마마,2022-02-06T04:57:25Z,11,main-comment
53,쎈 사람은 여유가 있다.. 정찬성한테 제일 어울리는 말인듯 ㅋㅋ 정찬성 말 하는데 여유 뒤진다,완희,2022-02-05T15:09:39Z,19,main-comment
54,ㅋㅋㅋㅋㅋㅋㅋㅋㅋㅋ부끄러움이라는 감정이 얼마나 중요한지를 알려주는 컨텐츠 ㄹㅇ,Dhd,2022-02-03T15:40:16Z,891,main-comment
55,하승진이 자존심 건들여서 포기를 못하게 만드네 ㅋㅋㅋㅋㅋㅋ,권민우,2022-02-07T14:21:30Z,1,main-comment
56,일권이형 평소랑 다르게 장난기 빼고 말하는모습 보기 좋네요,모올라,2022-02-07T12:16:27Z,0,main-comment
57,이 컨텐츠 쪼회수 짱난아니네여 형님 ㅋㅋ누구 기획이지 소고기 사줘야할듯,저는페미니즘을자지합니다,2022-02-07T05:03:18Z,2,main-comment
58,정찬성님 컨텐츠 선택하는 눈이 있으신듯<br>파이트클럽도 그렇고 이번에도 겁나 재밌네ㅋㅋㅋㄱㅋ,윤동주,2022-02-07T09:13:31Z,0,main-comment
59,"수유리사기꾼 말할때는 와... 존나 무서운 양아치구나... 했는데<br>저승문호님 등판하니까 왜이렇게 응애응애가 됐지..<br><br>확실히 운동경험 1도없는 일반인입장으로 보면 깡있는 양아치는 무섭지만 일반인들에게 항상 웃어주고 재미있는 컨텐츠 제공해주는 프로파이터가 훨씬 무섭다는걸 다시금 깨닳고 갑니다..<br><a href=""https://www.youtube.com/watch?v=hRPqJfo483c&amp;t=23m40s"">23:40</a> 개멋있당 ;",EZ Tiger,2022-02-07T04:34:21Z,2,main-comment
60,"<a href=""https://www.youtube.com/watch?v=hRPqJfo483c&amp;t=22m15s"">22:15</a> 문호형 여기 피하는거 존나 멋있다 만화같에<br>눈 깜빡안하는거 존나간지",kjk hvmhb,2022-02-06T00:14:33Z,10,main-comment
61,하승진 ㅋㅋㅋㅋㅋㅋ 자꾸 포기할라하는데 옆에서 바람넣네 못 그만두게 ㅋㅋㅋㅋㅋ,김헨리,2022-02-06T10:32:16Z,12,main-comment
62,합의적인 링위에 싸움으로 참교육하는 영상 만드시는데 너무 고생하십니다 여러분들은 진정환 환경 미화원이십니다,준민,2022-02-06T17:17:06Z,2,main-comment
63,문호형만 힐링캠프찍고있네 틈틈히 패면서 즐기고 있어 ㅋㅋㅋ,이성우,2022-02-07T12:27:54Z,0,main-comment
64,너무 재미있게보고있어요ㅋㅋ저도 어렸을때 몸이외소하고 키도작아서 운동을 배웠다가 학교다니면서 나쁜길로 조금 빠져서 싸움질좀 하다가 정신차리고 이젠 싸움을 안하는데 어렸을때 싸웠던 느낌이 물씬 느껴집니다ㅎㅎ너무 재미있습니다! 찬성이형님~그리고 다른분들 너무 재미있어요!!!,도마뱀,2022-02-05T18:01:34Z,0,main-comment
65,하승진 진짜 ㅋㅋㅋㅋㅋㅋㅋㅋㅋㅋㅋㅋㅋ 왜캐 재밌냐 ㅋㅋㅋㅋㅋㅋㅋ 너무 좋다,happynoonna해피눈나,2022-02-05T10:23:39Z,11,main-comment
66,나려타곤 잘 봤음 주댕이 파이터ㅎㅎㅎㅎ 진짜 쌈 잘하는 애들은 나데지 않음 하승진님의 팩폭 통쾌함 ㅋㅋㅋㅋ,최태혁,2022-02-06T11:15:19Z,1,main-comment
67,"ㅋㅋㅋ솔까 지난번에 기획 했던거보다 이게 더 잼씀 ㅋㅋㅋ  너무 진지하면, 아 유튜브까지 넷플처럼 각잡고 봐야하나 하면서 피곤하고 보기도 빡센데.. 이거는 라이트하면서 보기 편하고 웃음요소도 있어서 유튜브로 딱임",복마니형,2022-02-03T17:07:37Z,627,main-comment
68,뚝방전설 찾아다니는 컨텐츠... 재밌네요~~ 찐 전설이 발굴되면 진짝 대박치겠어요~ ㅎㅎ,DOOCHUL JEON,2022-02-07T14:50:07Z,0,main-comment
69,태양 눈 코 입 드립은 존나 웃기네ㅋㅋㅋㅋ 계속 와서 보게 됨,Kass Ssak,2022-02-05T12:31:30Z,10,main-comment
70,와 이거 엄청나게 재밌네 오늘 첨 봤는데 진짜 참교육 제대로인듯 ㅋㅋㅋㅋㅋ,푸푸,2022-02-06T09:30:16Z,0,main-comment
71,하승진 옆에서 존나 웃기네 ㅋㅋㅋㅋㅋㅋㅋㅋㅋㅋㅋㅋㅋㅋㅋㅋㅋㅋ 좋다,아지아지,2022-02-05T13:54:36Z,7,main-comment
72,정말 좋은 프로그램 같아요... mc분들 정말 든든하네요 ㅎㅎㅎㅎㅎㅎ 세계를 정화시키며 다녀주실거같아요 ㅎㅎ,현우튜브,2022-02-05T15:16:53Z,6,main-comment
73,찬성이형 역시 매너 말투행동에 매너가 묻어있어,제임스강,2022-02-06T03:13:58Z,1,main-comment
74,서장훈도 그렇고 하승진도 그렇고 농구 하던 사람들이 팩트를 잘 꽂네 ㅋㅋㅋ,김다니엘,2022-02-06T01:40:36Z,12,main-comment
75,이거 원래 기획의도랑 어느정도 차이 있는지 제작진 인터뷰 좀 보고 싶습니다ㅋㅋ,강을준,2022-02-06T16:41:07Z,1,main-comment
76,승진이형 일부러 자존심 조금씩 건드리면서 깐죽거리는거 너무좋아ㅋㅋ 양아치 자존심때문에 포기못하고 더 쳐맞음ㅋㅋㅋ,해븐,2022-02-03T18:45:55Z,504,main-comment
77,정찬성선수..처음부터끝까지 매너있는모습에 한번더 반하고갑니다<br>진정 멋있는분,탁남매TV,2022-02-06T05:03:48Z,3,main-comment
78,문호형님보다 체급 낮은 파트너 한명 더 데려와도 좋을 거 같은데,툟댧욳,2022-02-05T17:43:17Z,8,main-comment
79,보자마자 와 2화다!! 하고 나도 모르게 바로 들어왔어ㅋㅋㅋㅋㅋ<br>아 이거 너무 기다리게 돼요ㅋㅋㅋ<br>그리고 전과 20범이든 200범이든 앞에 있어도 아무말 안하고 앉아있는 정찬성 선수 너무 멋집니다 진짜 멋져요,파커피터,2022-02-05T06:51:06Z,4,main-comment
80,안일권 추리링바지 보플도 일어났데ㅎㅎ 쓸때없이 개웃기네 진짜ㅎㅎ,정지성,2022-02-06T08:40:56Z,1,main-comment
81,마지막에 인터뷰했던 사람입니다! 정찬성 선수분과 하승진님 안일권님 모두 바쁜 와중에 사진도 찍어주시고 너무 감사했습니다 정찬성 선수님 경기 잘 보고 있습니다 타이틀전 힘내세요!!,곽예찬,2022-02-03T16:15:35Z,1049,main-comment
82,"<a href=""https://www.youtube.com/watch?v=hRPqJfo483c&amp;t=22m28s"">22:28</a>  진짜 표정 바뀌는거 웃음벨이네",우육탕,2022-02-06T12:04:41Z,9,main-comment
83,"예전 &#39;주먹이 운다&#39; 같은 컨셉인듯 싶었는데 훨씬 속깊은(?) 프로그램으로 보이네요.<br>어쩌면 수유리 사기꾼 님은 지금쯤 너무나도 부끄러우면서도 여지껏 느껴본적 없는 홀가분함을 경험하고 있을지도요.<br>처연한 한마리 들개 같았어요. 저런 삶의 방식이 체화되기까지 많은 피해자가 나왔을 것이고, 본인 또한 그 중 하나라는걸 스스로는 몰랐겠지요.<br>진지하게 운동 시작하시고 보다 건설적인 삶을 살아가실 수 있기를-",JS L,2022-02-06T03:50:24Z,4,main-comment
84,아.. 그래도 러블리 문호형님 상대 지친후에는 살살쳐주는거 너무 스윗했어요!!,즐거운녀석,2022-02-06T12:57:20Z,0,main-comment
85,진짜 편집 너무 잘하는듯,sanghwan kim,2022-02-07T12:43:15Z,1,main-comment
86,어느 프로보다 컨텐츠 내용 의도 너무 좋습니다.곧 100만 가겠는데요?,권철현,2022-02-07T00:27:59Z,0,main-comment
87,문호님은 볼매남이네요ㅋㅋㅋ 보면볼수로 너무 좋음,초이,2022-02-05T22:49:39Z,0,main-comment
88,승진이형 입터는거 ㅈㄴ 웃기네 ㅋㅋㅋㅋㅋㅋㅋㅋㅋㅋㅋㅋㅋㅋㅋㅋㅋㅋㅋㅋㅋㅋㅋㅋㅋㅋㅋㅋㅋㅋㅋㅋㅋㅋㅋㅋㅋㅋㅋㅋㅋㅋㅋㅋㅋㅋㅋㅋㅋㅋㅋㅋㅋㅋ,박현진,2022-02-07T16:26:54Z,1,main-comment
89,찬성형 3편  너무 <br>보고싶어요..ㅋ,깍쟁이,2022-02-06T00:48:31Z,0,main-comment
90,프로그램 취지가 너무 좋습니다. 게스트로 나온 수유리사기꾼님도 많은걸 느꼈을것 같단 생각하니 가치있는 기획이라 생각합니다.,이도헌,2022-02-03T13:01:55Z,834,main-comment
91,진짜 ㅋㅋㅋㅋ 이제부터 싸움 기대 안하고 쳐맞기전에 얼마나 가오잡나 보는 재미로 본다,John_GH,2022-02-05T15:17:59Z,8,main-comment
92,넘나 반전인 실력.. ㅎ.; 앞으로 착하게 살아가시길,요리도:쥬아,2022-02-05T13:04:19Z,4,main-comment
93,정말 참된 갱생프로그램입니다...<br>범죄자들이 자신스스로가 얼마나 창피한 삶을 살고있는지 느끼게 해주는거같아 좋았습니다.,홍뽕식,2022-02-05T23:49:57Z,5,main-comment
94,오우 오우 승진이형 옆에서 팩폭박는거 너무<br>사이다여버리고 🤭🤭,wldh wjs,2022-02-07T15:22:55Z,0,main-comment
95,입터는거만보고 개잘할줄 알았더니 문호님한테 하는거보니까 분쇄기랑 웅진코웨이보다 훨아래 느낌이라 개웃김ㅋㅋㅋㅋㅋㅋㅋㅋㅋㅋㅋㅋㅋㅋㅋㅋ,Neul,2022-02-03T11:28:09Z,570,main-comment
96,확실이 제대로 된 빌런있으니 엄청 재밌네ㅋㅋㅋㅋㅋㅋ,섬딤섬,2022-02-05T10:25:39Z,2,main-comment
97,우연히 보게 되었는데 정말 재미있네요...여러가지로 방금 그 청년은 진심으로 뉘우쳐서 다시는 감옥에 가시지 말고 약자를 괴롭히지 않고 열심히 살길 바랍니다~~~~,이걷기운동,2022-02-06T00:26:14Z,2,main-comment
98,1화에 예능인줄 알고 잘못나온 귀염둥이들은 개그코드 좋았는데 ㅎㅎㅎ,홍성민,2022-02-07T16:23:09Z,0,main-comment
99,칼리 아르니스 배우시는 분 사람 자체가 멋있네ㅋㅋㅋㅋㅋ<br>경호 계통으로 일 하시는 분 같네,이효찬,2022-02-05T12:47:57Z,13,main-comment
100,"<a href=""https://www.youtube.com/watch?v=hRPqJfo483c&amp;t=23m40s"">23:40</a> 배맞는거 희열있네요 자꾸보러옴 내가다 속이 시원함",HA NA,2022-02-06T08:13:53Z,4,main-comment
101,역시 승진이형 와… 포스 진짜 죽이네.  멋진 아빠. 멋진 형. 멋진 사람,A Dean,2022-02-05T18:06:18Z,1,main-comment
102,문신따고 들어갔다 왔다고 가오잡고 자기가 쎈줄 아는 애들 이렇게 깨닫게 해주는거 좋은거같네요,김동언,2022-02-06T09:44:42Z,1,main-comment
103,요즘들어 죽음도 싸움도 자주 일어나는 장소가 정해져 있다는 것이 놀랍네요 👍근데 이거 도전자 받는 프로예요 갱생 프로예요? 문호 선수가 피지컬 개 털고 승진이형이 멘탈 짤딜 계속 넣으시고 도전자는 울라고 하고 ㅋㅋㅋㅋㅋ,Nitro Mare,2022-02-05T15:29:06Z,1,main-comment
104,문호프로님이 진짜 스파링 잘해주시네요. 바로 끝내지 않고 데미지만 줘가면서 도전자에 맞춰서 2분동안 격투실력 끌어낼 수 있게. 멋있어요.,JEON_이콩,2022-02-04T05:25:42Z,747,main-comment
105,따뜻하라고 덮어줄때 순간 맞는줄 알고 움찔 하는게 포인트,Who is Paran,2022-02-05T23:28:13Z,0,main-comment
106,힘드시겠지만 계속 해줬으면 좋겠습니다,The genius rich,2022-02-06T08:42:18Z,1,main-comment
107,마지막 쿠키영상좋다 ㅋㅋ 싸움을 잘하고 못하고 떠나서 저런 마인드가 멋이지,루카와,2022-02-06T09:51:51Z,0,main-comment
108,토크할때 서로 존나 기싸움하네ㅋㅋㅋ제일 쎈 정찬성은 정작 가만히 있는데,헤이헤이헤이,2022-02-06T11:39:48Z,4,main-comment
109,하승진 뒤에서 조곤조곤 트래쉬토킹하는게 너무 웃기네 ㅋㅋㅋㅋㅋ,오상근,2022-02-03T13:31:33Z,534,main-comment
110,@기리기리 이거지ㅋㅋㅋ,동동 리,2022-02-03T16:14:30Z,2,reply-comment
111,ㅋㅋㅋㅋㅋㅋㅋㅋㅋ ㅆㅇㅈ,Niké,2022-02-03T16:02:56Z,2,reply-comment
112,일부러 더 그러는거같음 ㅋㅋ 너 사실 ㅈ밥이야 넌 너보다 약한애들 괴롭힌거 뿐이야 를 심어주려고,기리기리,2022-02-03T15:36:16Z,37,reply-comment
113,이게 더 저 참가자에 어울리는 토킹임 ㅋㅋㅋㅋ,Slush vidyoz,2022-02-03T14:59:39Z,3,reply-comment
114,프로 농구로 다져진 실력 ㅋㅋ,장케빈,2022-02-03T14:21:23Z,78,reply-comment
115,정찬성선수 및 출연자분들 진짜멋있어요,게임하는 원숭이,2022-02-06T02:45:32Z,2,main-comment
116,참교육 멋집니다. 행여라도 여기서 졌다고 운동해서 또 싸우고 다닐까봐 걱정스럽네요. 그런일마저 하지않게 끝까지 참교육 부탁합니다.<br>맞는사람이 얼마나 아픈지 뼈져리게 느끼게해주는 이런프로 정말 기획좋네요,eunkyoung Style,2022-02-06T15:53:24Z,0,main-comment
117,정찬성씨 팬인데 요번거 재밌네요.<br>실력도 안되고 인성도 없는 인간들 참 교육 시키는 거 참 좋아요.<br>꼭 자기보다 약한사람 공격하는 인간들 교육이 필요하죠.,최강,2022-02-06T18:54:19Z,0,main-comment
118,찬성이형 옆에있을때는 순한 강아지였는데 ㄹㅇ,최정식,2022-02-06T10:23:58Z,0,main-comment
119,하승진님이 수유리 사기꾼 중간에 하차하지않고 끝까지 맞도록 옆에서 채찍질 잘해줌 ㅋㅋ 그리고 문호님도 2라운드까지 갈려고 1라운드 40초 남겨놓고 그냥 안때리시고 근데 정찬성님은 수유리 사기꾼 범죄자가 아닌 하나의 사람으로서 존중해주면서 훈훈하게 마무리.. 왜 정찬성 관장님인지 알 수있는 부분이였음. 안일권형님은 세계관 최강자시니까 끝까지 안싸워주셨음 좋겠음 싸우는 날에는 대한민국에 큰 지진이 날 수도 있으니까.,박찬희,2022-02-03T11:43:44Z,1704,main-comment
120,하승진 어이없다는 표정이 진짜 ㅋㅋㅋㅋ,두돧둗,2022-02-06T13:47:59Z,0,main-comment
121,양아치들 참교육 해주는 갱생 프로그램 넘 좋네요.,롤러코스터 남녀탐구생활,2022-02-06T11:01:09Z,0,main-comment
122,이때까지는 삶이 힘들었던거라면 남과 이쁘게 공존 하는 길로 행복을 찾길 바래요 동생 <br>응원합니다,alex BLUE,2022-02-05T17:07:59Z,5,main-comment
