,comment,author,date,like,type
1421,24살에 전과20범. 저런놈이 멀쩡하게 길거리에서 활개치는 것만으로도 이미 이나라 사회와 법은 정상이 아니다.,김동진,2022-02-03T14:38:48Z,54,main-comment
1422,그니까 저세키는 선빵+다구빨로 이긴넘이지  그냥 젖벱이지,진만호,2022-02-05T12:11:34Z,1,main-comment
1423,저건 그냥 일반인 중에서도 못하는 축인데 ㅋㅋ,H,2022-02-04T18:52:54Z,0,main-comment
1424,쟤 뭔가 성명준과다 괜히 쎄해😫,현민,2022-02-05T23:27:47Z,0,main-comment
1425,하승진 주절주절 말 많네 옆에서,손손민,2022-02-07T01:13:42Z,0,main-comment
1426,하승진 = 시청자<br>ㅋㅋㅋㅋㅋㅋㅋㅋㅋㅋㅋ<br>아니 찬성이형은 얼마나 쌘지 감도 안오네,그림판으로살아남기,2022-02-03T11:51:54Z,26,main-comment
1427,링을 좀 제대로 만들어 주고 하면 더 좋을거 같아요 허허,Jun,2022-02-06T11:54:15Z,1,main-comment
1428,하 ..... 진짜 역해서 보기 힘들다 .... ㅋㅋ,쮸당,2022-02-06T07:31:52Z,0,main-comment
1429,"<a href=""https://www.youtube.com/watch?v=hRPqJfo483c&amp;t=22m43s"">22:43</a> 너므 멋있어 버리규",도빙구,2022-02-04T19:50:05Z,0,main-comment
1430,양아치에 3류1류가 어딨음 <br>다 똑같은 양아치지 ㅋㅋㅋㅋㅋ,왕웅,2022-02-05T02:40:38Z,3,main-comment
1431,아 문호형 왤케 좋지?ㅋㅋ<br>너무 귀여우면서 무서우면서 매력있는 캐릭터..;;<br>이제부터 문호형 팬한다 ㅋㅋㅋㅋㅋㅋ,at시메오네,2022-02-03T11:24:30Z,12,main-comment
1432,가볍게 퐁퐁 치는 것 같은데 코피나고 난리 나네…,효은,2022-02-05T05:23:30Z,0,main-comment
1433,근데 저런 사람들은 운동배우면 운동배운걸 싸움으로 써먹을거같음;,그렇군,2022-02-07T11:06:43Z,0,main-comment
1434,"<a href=""https://www.youtube.com/watch?v=hRPqJfo483c&amp;t=22m15s"">22:15</a> 시작한지 10초만에 나온 &quot;뭐야?&quot;",minwoo Lee,2022-02-05T06:38:40Z,0,main-comment
1435,저도 이런거 보면 직접 제 능력을 테스트 해보고 싶어서 심장이 막 뛰는데 이제는 나이가 많이 먹어버려서 두려움이 더 크네요.. 그래도 언젠가는 꼭 도전해볼께요. 좋은 취지의 방송 너무 재미있게 보고있습니다. 👍,김영준,2022-02-04T17:21:34Z,5,main-comment
1436,하승진선수랑 안일권님 정말 섭외 잘한듯 케미 너무 좋다 ㅎㅎ,Kevin,2022-02-04T15:24:16Z,1,main-comment
1437,저런 젊은 청년들이 격투기 못해보이고 허세만 부리는 것 같아도 조심하시고 상대하는 일 없도록 하세요 여러분들 세상에서 제일 무서운 사람은 잃을게 없는 사람입니다..,H J,2022-02-04T16:05:17Z,35,main-comment
1438,"<a href=""https://www.youtube.com/watch?v=hRPqJfo483c&amp;t=26m16s"">26:16</a> 기쁜 표정을 주체하지 못함ㅋㅋㅋㅋㅋ",TERA BLUE,2022-02-04T17:03:56Z,18,main-comment
1439,범죄를 저지르고 다니는걸 자랑으로 알고 약한 분노 조차도 조절하지 못하는 양아치를 문호씨는 얼마나 때려주고 싶었을까요. 이게 현실이라는게 너무 안타깝습니다.,로또되고파요,2022-02-04T16:02:39Z,2,main-comment
1440,아 존나 재밋다 진짜ㅋㅋㅋㅋㅋㅋㅋㅋㅋㅋㅋㅋㅋ형 사랑해ㅋㅋㅋㅋㅋㅋㅋㅋㅋㅋㅋㅋㅋㅋㅋ,빅브라더,2022-02-04T15:57:58Z,3,main-comment
1441,스파링봐주시는분 진짜 개호감이네 ㅋㅋ ㅈㄴ멋있어,김민석,2022-02-04T15:49:23Z,5,main-comment
1442,3분만에 갱생이라니 전지전능하다 ㅋㅋㅋㅋㅋㅋ,AK K,2022-02-04T15:54:12Z,3,main-comment
1443,진짜 가정교육이 이래서 중요하구나...,유응,2022-02-04T15:23:45Z,2,main-comment
1444,뚜들겨 맞는데 근성있다 맺집좋다 이런말로 우쭈쭈 해주는거 너무 웃김,사과는맛있어,2022-02-04T17:27:38Z,1,main-comment
1445,대박 재밌네요 팬심빼고도 프로그램 너무 굿입니다! <br>문호선수님도 카리스마 멋지네여,D Zerox,2022-02-04T17:19:32Z,0,main-comment
1446,한편으론 아무도 옆에서 충고해줄 어른이없었던거 같아 안타깝네요…,쩡인데,2022-02-04T15:10:28Z,11,main-comment
1447,파이트클럽 느낌도 나고 콘텐츠 정말 신선하고 재밌네요ㅠ구독하구 갑니다!,doummal,2022-02-04T16:53:31Z,0,main-comment
1448,스토리가 았고 약간 양아치만 찾으러 가는 그런 프로그램도 좋지만(당연히 자금 큰 인기를 얻고있고)<br>다음번에는 진지하게 아마추어 파이터등 전문적으로 격투기 관련해서 이런 비슷한형식으로 안재 찾기 프로잭트를 하는것도 보고싶습니다,설탕,2022-02-04T15:49:28Z,5,main-comment
1449,하승진 캐스팅 신의 한수다,직장인,2022-02-04T15:21:22Z,2,main-comment
1450,참 좋은 기획이네요..<br>참교육이란 게 이런 거죠.,이병인(武夷),2022-02-04T18:31:56Z,0,main-comment
1451,아 ㅋㅋㅋㅋ문호 너무 멋져 ㄹㅇ ㅋㅋㅋㅋ,애인 장,2022-02-04T17:59:15Z,1,main-comment
1452,도전꼭 해보고싶습닉다! 한계를 느끼고싶습니다,홍승우,2022-02-04T15:37:52Z,0,main-comment
1453,승진이형 진지한모습 좋네요,김정훈,2022-02-04T16:53:03Z,1,main-comment
1454,흠.. 마음이 너무 아프네요.. <br>형들을 통해서 저친구에게 좋은 마인드가 전달되었길..!!,이선호,2022-02-04T17:09:36Z,4,main-comment
1455,크~문호님 스파링할때 침착하시네~<br>모든 상황에선 침착한게 중요,EARTH,2022-02-04T15:13:24Z,2,main-comment
1456,희철리즘에 캄보디아 갱스터 보다가 이거봤는데 진짜 아 너무 웃고갑니다,Love Kim,2022-02-04T17:13:58Z,1,main-comment
1457,어렸을때부터 잦은 범죄와 일탈을 하는 경우 뇌의 기능에 이상이 있을 수 있다라고 하는데.. 이 경우가 그럴수도 있겠네요. 사이코패스처럼 자신이 잘못됬다고 인식하지 못하는 거죠,현인,2022-02-04T16:37:17Z,2,main-comment
1458,유튜브 알람설정은 처음해보네요<br>다음화가 너무 기대가 됩니다.,이해원,2022-02-04T15:10:23Z,1,main-comment
1459,너무 재밌네요 다음편도 기대하겠습니다!!,보니보고,2022-02-04T16:20:08Z,1,main-comment
1460,우와... 컨텐트 지렸다...,TKmofos,2022-02-04T18:30:42Z,0,main-comment
1461,마지막에 인터뷰하는분이 정말 옳은거지,이호준,2022-02-04T15:46:26Z,2,main-comment
1462,문호형님 극호감이다 ㄹㅇ ㅋㅋㅋㅋㅋ,스니커,2022-02-04T17:47:43Z,1,main-comment
1463,승진이형ㅋㅋㅋㅋ 겐세이 귀엽네요 통쾌했습니다,한양,2022-02-04T15:57:51Z,2,main-comment
1464,선도방송 너무 좋아요,별이펄이,2022-02-04T16:01:40Z,0,main-comment
1465,"<a href=""https://www.youtube.com/watch?v=hRPqJfo483c&amp;t=21m39s"">21:39</a> ㅅㅂㅋㅋㅋㅋㅋㅋㅋ개웃기네 진짴ㅋㅋㅋㅋ",준,2022-02-04T16:19:08Z,4,main-comment
1466,오프닝이랑 담배꽁초로 혼내는 거 보면 그냥 mc 3명이서 만담 예능해도 재밌을 것 같은데 ㅋㅋ,Dong sm,2022-02-04T17:01:28Z,1,main-comment
1467,정찬성 리스펙트다 <br>정작 껄렁거려도 될 사람은<br>겸손 그 자체 ..<br>그와중 평택 영철 ㅋㅋ<br>갱생 프로였음<br>아주 좋아요 프로그램 취지,자낳고,2022-02-04T18:32:54Z,0,main-comment
1468,"와, 법무부에서 이프로그램 상줘야해~!!!",joypeace Park,2022-02-04T17:25:04Z,2,main-comment
1469,저 사람은 진짜 그냥 저게 당연하다는듯이 살아와서 잘못되었다는걸 처음부터 인지를 못하는 상황임 뭔가 안타깝다 타이슨도 불량아 였는데 커스 다마토라는 사람을 만나서 갱생했듯이 저 사람도 그런 사람이 있었다면 다르게 컷을수도 있겠지만 너무 늦었고 평생토록 변하진 않을 사람임 그리고 저 사람한테 당한 피해자들도 있을것이고 그 피해자들은 진짜 지옥과도 같은 자아 말살이나 흑화를 했을것임 악순환의 연속이다,BAB GUCK,2022-02-04T17:04:20Z,1,main-comment
1470,마지막에 출연하신분 넘 멋지네,ㅇㅇ,2022-02-04T18:27:58Z,0,main-comment
1471,수유리 사람으로 굉장히 창피하네요,헬리니,2022-02-04T15:50:25Z,4,main-comment
1472,1회 때랑은 인상이 확연히 다르네 ㅋㅋ,올레디,2022-02-04T16:04:32Z,2,main-comment
1473,하승진 존나잘갈구네ㅋㅋㅋㅋㅋ,조스타,2022-02-04T15:19:26Z,2,main-comment
1474,간만에 개 재밋는게 나왔네,Jonathan Joe,2022-02-04T17:28:58Z,0,main-comment
1475,문호님 진짜 지림,남자,2022-02-04T16:44:49Z,0,main-comment
1476,양아치 이런걸 떠나서 너무 귀엽다😍😍,유니크한닉네임,2022-02-04T16:50:11Z,0,main-comment
1477,정찬성선수 이번에 챔피언 먹을려면.. 허리회전의 몸통이용 쇼트펀치로 한단계 복싱스킬을 올려야 합니다.. 들어오는 상대를 쓱빡이 특기인데.. 반면 머리움직임이 없어 방어가 약점.. 타이슨 처럼 공격 후 항상 위빙 더킹을 습관적으로 2회 해서 상대공격을 흘려야 상대 헛점이 나옵니다..,성상모,2022-02-04T15:51:59Z,0,main-comment
1478,재밌지만 어딘가 찝찝함이 남는 건 왜일까,Lionel Messi,2022-02-04T16:30:41Z,0,main-comment
1479,"와 진짜 형님,,,,, 감동입니다 진짜<br>너가 강한 게 아니라, 약한 애들 한테만 너가 강했다는 말.. 즉 넌 우물안에 개구리 였다는 말씀을 <br>이 프로그램이 아니였다면, 저 친구는 경험 할 수 없을 겁니다. 자기 현실에 안주했을 것이고,그렇게악 순환이 반복 되었을 겁니다. 그런 삶의 태도는 자기 자신을 점점 더 늪의 수렁으로 빠지게 되었을겁니다. 너의 현주소는 사실 밑 바닥 이다.라는 것을 몸소 가르쳐 주셔서 시청자로써 너무 감사합니다 ! 돈 주고 봐야 할 진짜 값진 프로그램 같습니다.",설레는바디,2022-02-04T16:30:54Z,0,main-comment
1480,참 좋은 프로그램이네요,myonghoon kim,2022-02-04T17:42:27Z,0,main-comment
1481,확실히 배우고안배우고차이가 어마어마한것같습니다 배운사람이면 저렇게 자만하지도않았을듯,김민석,2022-02-04T15:46:02Z,0,main-comment
1482,저도 도전해보고싶습니다!,홍승우,2022-02-04T15:32:02Z,0,main-comment
1483,그냥 뭔가 화나기 보다 짠하다.. 어렸을때 힘든일이 많았나 아니면 가정교육을 잘 못 배웠나 이런 생각이 든다ㅠㅠ,황성우,2022-02-04T16:18:08Z,8,main-comment
1484,역시 김동현 형님 이야기가 맞네 <br>길거리 싸움 잘 한다고 체육관에 오는 사람들 모두 그냥 일반인이다,3p p,2022-02-04T15:21:41Z,1,main-comment
1485,정찬성 김동현 같은 사람들이 저런 쪽으로 안빠진게 천만다행이다,dd d,2022-02-04T18:24:58Z,0,main-comment
1486,사람들잌ㅋㅋㅋㅋㅋ대본이라고 생각한것도 웃곀ㅋㅋㅋㅋ오죽했으면ㅋㅋㅋㅋ케,신은선,2022-02-04T15:54:37Z,0,main-comment
1487,얘는 좀 불쌍하다.. 눈썹 내려간거만 봐도 약한 관상임. 약함을 감추기 위한 허세만 있을뿐. 아직 철이 안들었거나 좀  모자란 애를 참교육으로 포장했지 이건 아니다,goo gee,2022-02-04T15:24:13Z,5,main-comment
1488,고교시절을 흑형들과 보낸 저로서는 솔직히 귀엽습니다.. 일단 저렇게 옷과 머리를 하고 학교 나왔으면 게이라고 찍혔고 점심 시간에 런치타임에 런치머니를 뺐기지 않았을까 싶네요 심하면 게이친구가 생겼을수도<br><br>나오신분  bully beatdown 프로그램에 나가시면 원숭이교주님이 엄청 혼내주실거 같은데,Sam Kim,2022-02-04T17:57:17Z,3,main-comment
1489,ㅋㅋㅋ 파이터를 찾아라가 아니구 양아치들 참교육해주기 아닙니까,모행그♡,2022-02-04T15:30:30Z,0,main-comment
1490,세게 안때리는거 같은데 저래 파워보면 얼마나 쎈거야  ㄷㄷ,???,2022-02-04T16:18:40Z,2,main-comment
1491,일권이형 왜 사람을 죽일려고 하세요..ㅠㅠ 1라운드가 아니라 1초면 끝일건데 .. 쒸레기도 사람이니 많이 생각 해주신거 같네요,박민,2022-02-04T16:11:08Z,0,main-comment
1492,아무도 100만원 못 가져가는 건 아닌지ㅋㅋㅋㅋ,LOVER POOL,2022-02-04T18:02:52Z,0,main-comment
1493,세상 어디에도 나보다 강한사람은 있다는 말이 참... 세계 챔피언이라도 언젠가는 그사람을 꺾을 강자가 나타나기 마련이기도 하고 영원한 강자는 없나봅니다,민국,2022-02-04T15:29:19Z,0,main-comment
1494,문호님 나중에 불쌍해서 잘 안때리네 ㅋㅋ,박민,2022-02-04T15:56:22Z,0,main-comment
1495,"빨리3편이기대됩니다?4편인가요,.ㅋ",전인태,2022-02-04T15:50:19Z,1,main-comment
1496,문호님이 많이봐주셧네   수고하셧어요 문호선수님,주님의사랑을전하는자,2022-02-04T15:54:00Z,0,main-comment
1497,진짜 후리면 맞을거란 생각하지마라.<br>생각보다  그거보고 대응하면 선수가<br>우리나라에 널렸고 세계에 날렸다.<br>나조차 탑이라 생각했지만<br>세발의 피였다...,넘의 일기,2022-02-04T16:54:37Z,1,main-comment
1498,근데 진짜 실제 길거리에서 시비가 붙었는데 상대가 저런 격투기 선수라면 한대도 못때려보고 존나 쳐맞을듯 이런거보면 무섭네,김범수,2022-02-04T16:17:11Z,3,main-comment
1499,민짜에 무면허ㅠㅠㅠㅠㅠ도로에서 저런 친구 만날까 무섭다,신은선,2022-02-04T16:09:49Z,1,main-comment
1500,파이터 저 분 웃으면서 때리니깐 무섭네..,PerE _,2022-02-04T17:16:30Z,2,main-comment
1501,컨텐츠좋다,성장통,2022-02-04T17:42:26Z,0,main-comment
1502,영철이ㅋㅋ 기대된다 ㅋㅋ,다미,2022-02-04T17:11:06Z,2,main-comment
1503,얻어터지는거 ㄹㅇ사이다,이민재,2022-02-04T17:55:27Z,0,main-comment
1504,코좀님이 말하신 천재들 그 천재들은 복싱같은 무술하나도 안배운 가정하에 천재인가 궁금하네요,21살,2022-02-04T16:28:20Z,2,main-comment
1505,대하이햄한테 5초라도 버티면 인정해준다,aaa,2022-02-04T15:21:24Z,1,main-comment
1506,박문호님 아니여도 안일건달 형님 선에서 다 정리될꺼같은데 ㅋㅋ𐌅𐌅𐌅𐌅𐌅𐌅,차에미친남자,2022-02-04T16:58:56Z,0,main-comment
1507,그냥 유튜버 귀염둥이 하고 싶은거 아닌가?ㅋㅋㅋㅋㅋㅋ,김철웅,2022-02-04T16:00:39Z,0,main-comment
1508,프로 파이터가 맘먹고 치면 사람 잡는거 순식간이겠네. 진짜 쎄다ㄷㄷㄷㄷ,jk k,2022-02-04T17:10:18Z,1,main-comment
1509,잘되니까 보기 좋아,베엠베,2022-02-04T16:37:43Z,0,main-comment
1510,아.. 이 프로그램 뭔가 사람 마음을 왜이렇게 울컥하게 울리냐..ㅜ,햄톨 woki,2022-02-04T17:51:26Z,0,main-comment
1511,역대 최강빌런이다...,ff ff,2022-02-04T15:36:10Z,0,main-comment
1512,세상은 넓고 강자 많단다.,박도연,2022-02-04T17:05:27Z,1,main-comment
1513,진짜 저게 가오충들 수준임 ㅋㅋ 싸우는거보면 10명중에 9명은 다 붕붕훅 밖에 못함 <br>와중에 승진이형 트레쉬토크 ㅆㅅㅌㅊ노 ㅋㅋㅋㅋ,이대호,2022-02-04T18:07:50Z,0,main-comment
1514,수유에서 저런 병..따구리 본적 없는데 ㅋㅋㅋㅋㅋㅋㅋㅋ,두부아빠,2022-02-04T17:45:29Z,1,main-comment
1515,자기 실력을 인정하고 진심인진 몰라도 어느정도 깨닮음을 얻은 모습은 나빠보이지 않으나 본인이 행한 범죄를 자신있게 말하는건 겁이 없어 보이는게 아니라 지능이 없어보입니다.. 무면허인데 차량 절도 후 운전까지 해서 사고를 냈다는건.. 영상에는 안나왔지만 어디에 박았는지.. 가로수 같은데 박으면 다행인데 무면허인 상태로 차량을 절도해 운전하는건 운이 나쁘면 (운이 나쁘다 말하는 것도 찝찝하긴함) 행복한 한 가정을 멸족시킬수도 있는 행위인데 말과 생각이 너무 가벼워 보이네요. 본인이 부리는 허세는 자신감과 채면이 아니라 비합리적인 낙관이며 휘둘렀던 주먹은 힘이 아닌 치기였을 것 입니다. 이번 기회로 많은 생각을 했으면 좋겠네요.,Djdjjcjcdjhe Sjdjcjrje,2022-02-04T15:21:49Z,0,main-comment
1516,안일권하고 안 붙여서 조회수 50만회는 손해본거다....,주린이2,2022-02-04T16:37:02Z,1,main-comment
1517,그냥 울려고 하는뎈ㅋㅋㅋ,K T,2022-02-04T15:54:29Z,0,main-comment
1518,딱봐도 적밥 지그레기들밖에 안나오누 .. 다음을 기대해보며 기다리겠!!,소갈비살,2022-02-04T17:09:37Z,0,main-comment
1519,ㅋㅋㅋ 소개해준 그 복싱하는친구가 제일나쁘면서도 착한친구인가,Shaken Not Stirred,2022-02-04T17:24:18Z,0,main-comment
1520,"애초에 저 참가자가 때렸던 사람들은 다는 아니겠지만<br>참가자의 기습과 잃을것 없는 공격성에 대항할 의지를 상실한게 커보이고<br>저 참가자는 그게 자신의 실력이라 착각하고 살아온듯 합니다<br><br>보통의 사람들은 굳이 물리적인 싸움을 꼭 이겨야한다는 강박증을 가지지도 않고<br>그래서 참가자같은 잃을것 없는 인간이 돌발적으로 공격해오면 의지를 상실합니다. 무의식적으로 발현될만한 운동을 하지않은 이상은요.<br><br>그리고 저런 인간들은 자기가 이길만한 상대인지 질것같은지 파악이 제법 빠르고 정확합니다. 이건 독기 소위 말하는 깡도 포함될것 같습니다.  져도 이길때까지 덤비는 독기와 집요함도.<br><br>실제 주변에 그런 사람이 있었고 문호님 반도 안되지만 운동한 임자 만나서 밟히며 현실을 자각했었죠, 그 인간도.<br>근데 술마시고 자기가 그런짓하던 비슷한 분위기가 조성되면 그 버릇이 또 나오더라구요<br>그래서 저는 사람은 어지간해서는 변하지 않는다 생각합니다. 상황이 변하는거죠.<br><br>한가지 참가자가 운동해야겠다는 생각이 잠시라도 드는 순간에서 되도록 빨리 운동하시면 좋겠습니다<br>운동이 좋은건 강해지며 오히려 자제력이 생기며 동시에<br>세상에는 강한 사람이 많구나 하는 체감 기회를 가지는게 최고의 약이라고 생각합니다. 진짜 강한 사람이 많거든요. 그걸 느껴야 변합니다.",go tune,2022-02-04T17:33:05Z,5,main-comment
1521,수유가믄 만날수 있을까? 나도 수유인데 ㅋㅋ<br><br>참교육 지대루 해주셔서 잼있거 봤습니다,신짱구,2022-02-04T15:41:02Z,1,main-comment
1522,응원합니다,seonok shin,2022-02-04T17:36:44Z,0,main-comment
1523,진짜 아무것도 모르는 애송이다,Matroos,2022-02-04T18:28:27Z,0,main-comment
1524,그래도 선수가 매너있게 얼굴은 살살치고 배만 존나 세게 갈기네 ㅋㅋㅋㅋㅋㅋㅋㅋㅋㅋㅋㅋㅋ,JaeHo Lee,2022-02-04T15:09:57Z,1,main-comment
1525,풉!!!!!ㅋㅋㅋㅋㅋㅋㅋㅋㅋㅋㅋㅋㅋㅋㅋㅋㅋㅋㅋㅋㅋㅋㅋㅋ 주변에 강한사람이 없었네 ㅋㅋㅋㅋㅋㅋㅋ,꽃사슴,2022-02-04T15:13:20Z,0,main-comment
1526,24살이에요?? 진짜 철없어도 철너무없다 평생 깡패같이살사람이네요<br>전과20범이라고 소년원가서도 주먹질했다 자랑질하질않나<br>하승진하고 안일권 정찬성 말하는도중 말을 짤라먹질않나  사람이말하는데 위아래가없네요 <br><br>내가제일싫어하는사람이 상대방이 말좀끊어도될가요?? /얘기하는데 말을 짤라먹는사람 / 왜 사람말 이해못해 라는사람<br>저분은 제가봤을땐 진짜 참안됐습니다,Untamed young,2022-02-04T15:09:50Z,2,main-comment
1527,파이터를 떠나서 어떤 분야든 프로한테는 덤비면 안된다는걸 다시 깨닫고 갑니다 손흥민한테 축구로 깝치면 안되듯이ㅋㅋ,ᄋᄆᄋ,2022-02-04T15:21:12Z,0,main-comment
1528,가드 일부로 내리고 해주시는데 밀리네 이건 쫀게 맞다,04 25,2022-02-04T16:05:07Z,0,main-comment
1529,술은 아무나 마시게 하면 안된다 일단 전과 있으면 팔지 말자,늘슬아,2022-02-04T17:06:14Z,0,main-comment
1530,저 자갈치시장 전과0범 머스마인데<br>일권이형은 제 선에서 정리가능.<br>이건 기회야,지아코,2022-02-04T16:54:28Z,1,main-comment
1531,전과 20범이 뭐가 자랑이라고 실실쪼개냐..,얼굴가격,2022-02-04T16:00:57Z,1,main-comment
1532,양아치 깨갱 ㅋㅋㅋㅋ 일권이형이 상대해주지 ㅋㅋㅋ,절봉이,2022-02-04T15:57:39Z,0,main-comment
1533,글러브 처음껴보고 싸우는 사람이면 금방 느낄거에요 스파링한다는게 생각보다 체력이 굉장히 많이 소모되고 글러브도 무겁게 느껴져서 가드를 올리는거 조차 지치죠 게다가 헤드기어는 답답하고 시야고 가리고 맞다가 조금 돌아가기라고 하면 어떻게 해야할지 몰라 당황하게 되죠 깡따구 좋은거 보니 짧은 시간에 끝나는 길거리에선 잘 싸우셨을거 같네요,김C,2022-02-04T17:18:47Z,2,main-comment
1534,이기회에 정신 좀 차렸으면 좋겠네요.,윰윰,2022-02-04T15:23:52Z,0,main-comment
1535,이친구는 1편 인천애들선에서 정리될듯...,최한성,2022-02-04T18:22:06Z,3,main-comment
1536,겁이 너무 많은데ㅋㅋㅋㅋㅋㅋㅋㅋ,김도경,2022-02-04T15:44:19Z,1,main-comment
1537,개꿀잼,어흥어흥,2022-02-04T17:08:28Z,0,main-comment
1538,다음 도전자 타노스급 빌런이라고 하는사람이네 <br>김동률 감사 듣고 알았다 ㅋㅋㅋㅋㅋㅋㅋㅋ,바다총각,2022-02-04T15:50:13Z,0,main-comment
1539,그 옛날에 해외에 불리비트다운 그 느낌이네ㅋㅋㅋㅋㅋ,LFC,2022-02-04T16:08:39Z,2,main-comment
1540,구독했어요❤️,진짜즐거움,2022-02-04T17:28:58Z,0,main-comment
1541,앤 그냥 마구잡이네. 인천애들은 그래도 좀쳣는데. 문호 개빡침 ..하승진 그외중에 계소구약올려 ㅋ<br>근데 체급차이땜 다가가기 힘든건 사실이당. 너무 큰 체급으로 댈구왓어,머야ᅳᅳ,2022-02-04T15:23:37Z,1,main-comment
1542,역시나 말 떠벌리는 인간치고 실력있는 인간을 못봤다,대박사장님,2022-02-04T17:14:18Z,0,main-comment
1543,이래서 &#39;미필&#39;이 안된다니까,김규원,2022-02-04T18:13:33Z,0,main-comment
1544,ㅋㅋㅋㅋㅋㅋ 울먹거리면서 싸우는거 귀엽노,아리,2022-02-04T16:39:47Z,0,main-comment
1545,어짜피 막장으로 살아왔는데 얼굴까고 유명해지는게 오히려 이런애들한테는 기회지..<br>그리고 저런애들은 운동 배워서 제대로 더 양아치짓 할 애들임... 갱생절대 안됨,감탄쟁이,2022-02-04T17:15:30Z,0,main-comment
1546,그냥 술취한사람만 골라 떄렸었나보네 ㅋㅋㅋㅋㅋ,머선12 go,2022-02-04T16:34:31Z,4,main-comment
1547,인정하는건 좋다,신은선,2022-02-04T16:22:03Z,0,main-comment
1548,젊다고 나라에서 봐주니 3류인생 사는겁니다.<br>약한사람 괴롭히고 폭행한게 자랑이라고 떠들고 ㅋㅋ<br>타투도 3류네요 ㅋㅋ,복남,2022-02-04T16:20:57Z,1,main-comment
1549,3화 나는솔로 영철이네ㅋㅋㅋㅋㅋㅋㅋㅋㅋㅋ,스타그램,2022-02-04T16:30:33Z,1,main-comment
1550,수유리를 기대했지만 까고보니 인천이 훨쎄네 ㅋㅋㅋㅋㅋㅋㅋ,Ana Fernández García,2022-02-04T15:21:27Z,3,main-comment
1551,다음편 707 영철 이면 그 짝 찾는 프로그램 나왔던 사람아닌가,재엽 정,2022-02-04T16:12:51Z,4,main-comment
1552,몸만 성장하고 지적나이는 아직 중2에 머물러 있는거 같음,JW K,2022-02-04T16:12:54Z,4,main-comment
1553,ㅋㅋㅋㅋㅋㅋㅋ 3류라고 하기도 부끄럽다,아리,2022-02-04T16:38:30Z,0,main-comment
1554,너무 잣밥들만 골라서 패는거같아서 좀...   그래도 체급은 맞춰주지   이래서 누가 100만원 타겠어,kukuri,2022-02-04T16:24:00Z,1,main-comment
1555,상대성이론이라고생각하기엔 그냥 ㅋㅋㅋㅋㅋㅋㅋㅋㅋㅋㅋ동네 싸움좀한다하는애들수준도안됨ㅋㅋㅋㅋㅋㅋㅋㅋㅋㅋㅋㅋㅋ,ᄉᄉᄉᄋᄋᄋ,2022-02-04T16:22:56Z,1,main-comment
1556,이 프로그램 급호감이다. 리얼 이런거 떠나서 뭔가 울림이 있네.. 느낌이 너무 좋다,방울토마토,2022-02-03T11:15:40Z,3,main-comment
1557,문호형이 진짜 100퍼센트로 하면 울면서 가는거 보고싶다 ㅋㅋㅋㅋㅋㅋㅋㅋ,삼평동손톱돼지,2022-02-03T11:05:10Z,27,main-comment
1558,진짜 정찬성 눈에 얼마나 같잖아 보일까 ㅋㅋㅋㅋㅋㅋㅋㅋ,캡틴팔크,2022-02-03T11:04:11Z,40,main-comment
1559,하승진이 진짜 피지컬로 압도 시키고 <br>중간마다 팩폭 날리는거 개좋네.....<br>공인인거 내려 놓고 욕할때 개시원하게 박아줬으면 좋겠다...,으유유,2022-02-04T13:09:03Z,27,main-comment
1560,지난번도 그렇고 출연하는분들 다 뒤끝없이 인정하는 모습 좋네요,김무성,2022-02-03T16:14:13Z,7,main-comment
1561,그래도 인정하는 모습은 멋있다 ㅎㅎㅎ 좀비트립 줜나 잼있네 ㅎㅎ,jy yoo,2022-02-03T12:26:56Z,6,main-comment
1562,ㅋㅋㅋㅋㅋ정규방송으로 편성됬음 좋겠다ㅋㅋㅋㅋㅋㅋㅋㅋㅋㅋ,정상훈,2022-02-03T20:36:41Z,9,main-comment
1563,웬만한 개그 프로그램 보다 이게 훨 웃기다 ㅋㅋㅋㅋㅋㅋㅋㅋㅋㅋㅋㅋㅋㅋㅋㅋㅋㅋㅋㅋㅋㅋㅋㅋㅋㅋㅋㅋㅋㅋㅋㅋㅋㅋㅋㅋㅋㅋㅋㅋㅋㅋㅋㅋㅋㅋㅋㅋㅋㅋㅋㅋㅋㅋㅋㅋㅋㅋㅋㅋㅋㅋㅋㅋㅋㅋ,민정우,2022-02-03T11:04:05Z,15,main-comment
