,comment,author,date,like,type
538,이렇게 미래의 챔피언이 탄생하게 되는데.....,ASTRA,2022-02-05T07:58:18Z,0,main-comment
539,아 완전 재밌다 ㅋㅋㅋ,luckyF3,2022-02-06T02:24:51Z,0,main-comment
540,역시 하승진 nba에서 흑인들이랑 농구하더만 옆에서 트레쉬 토크하는게 씹넘사구만 !!!,brain dirty,2022-02-05T08:58:55Z,1,main-comment
541,스파링 끝나고 양손 모으게 더 해줘야 하는데 아쉽네ㅋ,김라리,2022-02-06T03:52:30Z,0,main-comment
542,근데 이번 참가자는 양아치 치고 남자인게 진거를 깔끔하게 인정을하네 이건 멋지네 누구처럼 잠을 못자서요 ㅇㅈㄹ은 안하네 ㅋㅋㅋ,kan,2022-02-06T12:38:25Z,2,main-comment
543,체급도 크고 게다가 사우스포면 뭐 겜 자체가 안되죠. 복싱 오래해도 사우스포는 늘 어려운데 일반인은 뭐 신세계를 경험하는거지.,보볼,2022-02-06T14:44:52Z,0,main-comment
544,"첨 등장때만해도 인천보다 쎌거라 생각했는데 막상 시작해보니 인천보다 약한듯 <br>인천 등장인물중 한명은 그래도 로또펀치 한방이라도 꽂아보고 태클 시도도 제대로 해봤는데 <br>저 사람은 태클도 못하고 체력 딸려서 후들거리는게 보이네요. 술을 많이 먹어대서 그런가? <br>아무래도 길거리에선 제대로 된 싸움꾼을 얻기엔 힘들지 않나 싶습니다. <br><br>신체조건도 좋고 싸움을 즐기는 사람이어야 아마 만족 하실듯 한데, 그런사람은 진작 격투기 배우고 선수로 활동 하지 않을까 싶어요<br>최두호 선수가 대구에서 알아주는 싸움꾼이었단 소리를 들어본것 같은데 그런 재능 있는 사람은 벌써 격투기 선수가 되있지 않을까 합니다",Rayzard,2022-02-05T17:29:03Z,0,main-comment
545,이번 편에서 찬성이형 많이 웃는데 너무 귀여워 ㅋㅋㅋ,Doyeong Jung,2022-02-04T21:27:08Z,15,main-comment
546,얼굴 다 찌그러져서 허공에 붕붕하다가 체력 다 빨리고<br>지가 어디 서 있는지도 모르고 등 뒤에 기둥있으니까<br>어?ㅇㅈㄹㅋㅋㅋㅋㅋㅋㅋ,찬바람,2022-02-06T11:31:52Z,1,main-comment
547,안일권형님 멋지다,민영 이,2022-02-07T14:12:33Z,0,main-comment
548,진짜 현실이네 파이터와 일반인,신지섭,2022-02-05T21:05:05Z,0,main-comment
549,문호 이길 일반인 없을거 같은데....,최잔고목,2022-02-06T17:26:14Z,0,main-comment
550,진짜 프로의 벽은 넘사벽이네요<br>너무 멋지고 정찬성님 끝까지<br>예의지키며 배려하는 모습 멋지네요,백마탄서민 TV,2022-02-03T14:47:11Z,31,main-comment
551,군대에서 이런케이스많이봤는데. 허세는떨어도 뭔가귀엽고 옆에있으면 짜증나는애들 다 무논리로 조져줌 ㅋㅋㅋ,ᄋᄋ,2022-02-07T09:22:30Z,1,main-comment
552,"진짜...........어디가서 보기 힘든 펀치였다 ㅋㅋㅋㅋㅋㅋㅋㅋ, 기본기가 전혀 없구나...............",惡卽斬.,2022-02-05T09:24:20Z,0,main-comment
553,배 뚜들겨맞을때 ㅈㄴ웃기네진짵ㅋㅋㅋㅋㅋㅋㅋㅋㅋㅋㅋ,김태완,2022-02-05T12:44:27Z,0,main-comment
554,"야 이거 간만에 진짜 재밌다 . 참가자들 나올때 살기등등하고 기쎈거 느껴지는데 걍 문호 행님이 초살시키네, 와 진짜 정찬성 형님은 무슨  만화 실눈캐 같네 웃으면서 하찮게 보는 그게 느껴진다",이동규,2022-02-03T12:58:41Z,26,main-comment
555,리바이 병장만났으면좋겠다,이도현,2022-02-05T20:02:45Z,0,main-comment
556,스파링 시작할때부터 애초에 페이스 다 말리고 했네 겜이 될리가..,hash ash,2022-02-05T14:23:13Z,0,main-comment
557,복싱을 글로 배웠으니 맞을리가 있나..,상구 비,2022-02-06T11:58:13Z,2,main-comment
558,이런게 진정한 승부지요.<br>저런 후랴덜* 양아치는 고수들의 뜨거운 맛을 맛봐야 깨닫게되고 약자에게 고개숙일줄알게된다.<br>반성하고 약자에게 늘 더 고개숙이는 사람이 되시게,만수르,2022-02-05T12:07:33Z,0,main-comment
559,문호님 사기꾼이 야매킥 날리니까 바로 그대로 킥하면서 이게 정자세라고 보여주는거 대박이다ㅋㅋㅋㅋㅋㅋ,얄라차,2022-02-03T13:48:19Z,210,main-comment
560,다른건 다 그렇다 치더라도 자기 전과 이력과 소년원 구치소 갔다온걸 저렇게 자랑스럽다는 듯이 이야기하는걸 보면 정말 너무나도 한심해보인다.,이민우,2022-02-05T17:16:08Z,0,main-comment
561,"출연자가 양아치라고 해서 격투기, 참교육을 빙자하여 폭력을 행하지 않도록 조심했으면 합니다. 누가 누굴 교육시킬 권리는 없어요. 그저 챌린지에만 그치길",HY K,2022-02-05T09:35:45Z,4,main-comment
562,깨달음을 느끼면 엄청 쪽팔릴것이다,ABC,2022-02-06T06:16:45Z,0,main-comment
563,"<a href=""https://www.youtube.com/watch?v=hRPqJfo483c&amp;t=16m07s"">16:07</a> 손 존나 떪 ㅋㅋㅋㅋㅋㅋㅋㅋㅋㅋㅋㅋㅋ 목소리도 떨리고 ㅋㅋ 나중에 안떠는 척 하려고 &#39;아유 추워&#39; ㅋㅋㅋㅋㅋㅋㅋ",호호,2022-02-05T12:13:16Z,3,main-comment
564,하승진님 옆에서 말한마디한마디 자존심 긁는거 레알 통쾌하다ㅋㅋ<br>포기해도 된다하는데 계속해서 더쳐맞네ㅋㅋㄱㄱㅋ,필반나.차전.,2022-02-04T05:36:53Z,123,main-comment
565,ㅊ초반 담배골목 줮밥들 가오존나잡다가 하승진형한텐 벌벌기넼ㅋㅋㅋ,KAI GREENE,2022-02-06T06:23:20Z,0,main-comment
566,"<a href=""https://www.youtube.com/watch?v=hRPqJfo483c&amp;t=29m18s"">29:18</a> 엔딩 쿠키<br>멋짐",ICE Americano,2022-02-06T09:29:05Z,0,main-comment
567,평택 영철 기대됩니다 ㅋㅋ,111 EM1,2022-02-05T15:27:38Z,0,main-comment
568,아니 일반인중에 문호님 이기는 사람을 찻고잇다는거죠?지금?,carpe diem11,2022-02-06T05:49:42Z,0,main-comment
569,하승진 진짜 섭외 잘한듯 ㅋㅋㅋㅋㅋㅋㅋㅋㅋㅋㅋㅋㅋㅋㅋㅋㅋㅋ,김형규,2022-02-03T11:04:17Z,238,main-comment
570,수유 토백이인데여. . 여긴 평일에도 경찰출동하는 곳이고 어깨빵 조심하세요 ㅋㅋㅋ,나는야인이될거야,2022-02-05T15:22:02Z,0,main-comment
571,파이터를 찾아다니는걸 빙자한 정신 못차리고 양아치짓 하는 반달들 참교육하러 다니는 컨텐츠같다.,ㄲㄲㄲ,2022-02-06T05:38:38Z,0,main-comment
572,가짜사나이 기획 이상으로 잘 되시길 빕니다!,Earth3 planet,2022-02-05T22:19:14Z,0,main-comment
573,와 드뎌 영철이 패주나,쳐니,2022-02-06T09:00:57Z,0,main-comment
574,정찬성은 가장 강하지만 누구보다 공손하고 친절하다.. 수컷들의 기싸움도 물론 재미의 요소겠지만 세 분의 엠씨가 어른으로서 포용해줬으면 하는 마음..,데하드,2022-02-03T11:48:26Z,96,main-comment
575,인생 진짜 막장이구나;;;,활기찬 생활,2022-02-06T16:31:08Z,0,main-comment
576,"<a href=""https://www.youtube.com/watch?v=hRPqJfo483c&amp;t=24m30s"">24:30</a> 하승진 오른쪽에 계시는 분 별거 안하시는데 왤케 ㅈ간지 나지 포스있음ㅋㅋㅋ",임플란티드 키드,2022-02-07T14:49:50Z,0,main-comment
577,사람이 싸이코라서 피하는거지 에구... 불쌍<br>정신좀 많이차렸으면 좋겠네 이런 사람들,Sin카이젠트,2022-02-05T07:00:04Z,0,main-comment
578,타투 돈없어서 도안만그린거 개웃기네ㅋㅋ,PISICK,2022-02-05T09:46:08Z,0,main-comment
579,"정찬성은 싸울때는 카리스마 그자첸데, 평소에는 자세도 어정쩡하게 서있고 말투도 차분하게 스윗 그자체고 완전 반전이넼ㅋㅋㅋㅋ",홍우재,2022-02-03T10:51:12Z,87,main-comment
580,@원투펀치킥 그럴지도?,멍멍,2022-02-04T10:51:13Z,0,reply-comment
581,@멍멍 니 지능보단 나을듯,원투펀치킥,2022-02-03T22:09:59Z,2,reply-comment
582,@우디 댓글 작성자는 그걸 아니까 이런식으로 댓글을 단건데 설명 해주는건 눈치가 없는건가 지능이 딸리는건가,멍멍,2022-02-03T19:19:22Z,0,reply-comment
583,원래 진짜 싸움꾼은 평소엔 천사에요. 싸울때 좀비로 변하니까 문제지,우디,2022-02-03T11:56:46Z,6,reply-comment
584,@근성이 ㅋㅋㅋ너 일상생활 가능?,멍멍,2022-02-03T11:49:50Z,0,reply-comment
585,살면서 한번도 싸움해본적없지만 도전해보고싶네요 부산입니다90년생,김민재,2022-02-06T17:46:33Z,0,main-comment
586,"<a href=""https://www.youtube.com/watch?v=hRPqJfo483c&amp;t=15m09s"">15:09</a><br>지원자: 엄마 이거 무슨차야?<br>지원자 부모님: 응~ 양육포기절차~",우주구라,2022-02-06T04:38:58Z,0,main-comment
587,우네 울어 ㅋㅋㅋㅋㅋㅋㅋㅋㅋㅋㅋㅋㅋㅋㅋㅋㅋㅋㅋㅋㅋㅋㅋ아 진짜 ㅋㅋㅋㅋㅋㅋㅋㅋㅋㅋㅋㅋㅋㅋㅋㅋㅋㅋㅋㅋㅋ배잡고웃었닼ㅋㅋㅋㅋㅋㅋㅋㅋㅋㅋ혹시 내 배꼽 부산에 있습니깤ㅋㅋㅋㅋㅋㅋㅋㅋㅋㅋㅋㅋㅋㅋㅋㅋㅋㅋㅋ배꼽 찾아욬ㅋㅋㅋㅋㅋㅋㅋㅋㅋㅋㅋㅋㅋㅋㅋㅋㅋㅋㅋㅋ,art_88,2022-02-05T11:55:19Z,1,main-comment
588,줜나 재밋네,박노민,2022-02-06T02:11:41Z,0,main-comment
589,정찬성 계속웃어주거 진짜 여유있어보이고 성격좋으시다,붕붕이,2022-02-05T02:46:29Z,158,main-comment
590,세상은 넓고 무서운 사람은 많다.<br>자만하지 말고 항상 겸손하라.,zombie 082,2022-02-07T06:35:28Z,1,main-comment
591,광주도 오시면 잼날듯 ㅋㅋ,ᄋᄋᄋ ᄋ,2022-02-06T19:57:27Z,0,main-comment
592,마지막 칼리아르니스 하신다는분!잘생겼다,금동gold bronze life!,2022-02-06T16:41:48Z,1,main-comment
593,장난안치고 제대로하면 저친구는 일권이형한테 얼굴 벌집됬다..,인생,2022-02-07T12:52:42Z,0,main-comment
594,여윽시 문호형 타격 시워언~~하다~!<br> 수유리사기꾼 반성하는모습도  보기좋쿠여~!<br>일권이형 예고편 제대로 뽑았었군ㅋㅋㅋㅋㅋ,안라딩,2022-02-03T17:31:05Z,30,main-comment
595,ㅈㄴ 웃기네 ㅋㅋㅋㅋ 몸좀 만들엇다고 생각햇뎈ㅋㅋㅋㅋㅋㅋㅋ ㅅㅂ 누가봐도 순두부몸인데,Loopy,2022-02-06T15:05:10Z,0,main-comment
596,ㅋㅋㅋㅋㅋ좆나웃기넼ㅋㅋㅋㅋ오뚜기가,김민제,2022-02-07T10:23:52Z,0,main-comment
597,역시나...<br>약자들만 골라패는 양이었나??,E.K,2022-02-05T17:12:16Z,0,main-comment
598,그래도 당당히 얼굴 까고 나온 용기가 기특합니다.,P V,2022-02-05T09:30:52Z,0,main-comment
599,문호님의 침착하면서도 담담한 눈빛이 존멋이긴 한데 무섭다 ㄷㄷ<br>저게 ㄹㅇ 프로의 영역이구나,임수빈,2022-02-03T12:35:59Z,50,main-comment
600,수유리에 저런 사람이 있었다구요...? 진짜 같은 동네사람이지만 부끄럽네요,안준서,2022-02-06T09:44:58Z,0,main-comment
601,저 사람은 이때까지 깡다구 하나로 싸운거네<br>근데 약자랑 싸워서 너무 기세등등해져서 살아온듯,뀨무룩,2022-02-07T02:26:04Z,0,main-comment
602,표정이 겁에 질렸네요 ㅎㅎㅎ,취미생활,2022-02-05T15:07:48Z,2,main-comment
603,"<a href=""https://www.youtube.com/watch?v=hRPqJfo483c&amp;t=22m25s"">22:25</a> 너무 못하는데?<br><a href=""https://www.youtube.com/watch?v=hRPqJfo483c&amp;t=22m52s"">22:52</a> 쪼는거봐 어휴~<br><a href=""https://www.youtube.com/watch?v=hRPqJfo483c&amp;t=23m00s"">23:00</a> 버티네~ 근성있네~ 근성있어~ 좋아~<br><a href=""https://www.youtube.com/watch?v=hRPqJfo483c&amp;t=23m14s"">23:14</a> 아님 그만 하던가~<br><br><br><br>승진이형 싸이코야…..? 무서워 나……",방구석여포참많다,2022-02-06T14:45:08Z,3,main-comment
604,프로그램 취지가 좋네요^^  싸움이 얼마나 의미 없고 멍청한 짓인지 깨닫는 계기가 됐으면 좋겠네요. <br>온몸에 힘이 들어가고 기가 세신 분들은 격투기를 배워서 스포츠로 스트레스를 풀며 몸을 단련하길 바랍니다.,bk k,2022-02-03T11:01:12Z,71,main-comment
605,역시 인간은 쳐맞아야 정신차려<br>말로 백번말해도 안되는거 몇번 쳐맞으니까 반성하는척이라도 하자나,헤이헤이헤이,2022-02-06T12:00:55Z,1,main-comment
606,싸움을 잘한다기보단<br>그냥 사고를 많이친 사람같은느낌,츄리보,2022-02-05T13:44:01Z,1,main-comment
607,저 정도면 MMA 가 아니라 헬스장 새해 3개월충선에서 정리될듯,권기범,2022-02-06T02:30:07Z,0,main-comment
608,화목에 업로드해주면 안되나....너무재밌는데,순후추,2022-02-05T10:03:03Z,0,main-comment
609,문호씨 여기서 하루 스트레스 다 풀고가시네요ㅋㅋㅋㅋㅋㅋㅋ<br>1주일중에 이 촬영날만 기다리실듯<br>왜이렇게 밝으세요 ㅋㅋㅋㅋㅋㅋㅋㅋㅋㅋ,baro sp,2022-02-03T11:16:24Z,85,main-comment
610,ㅋㅋㅋㅋㅋ개그캐네ㅋㅋㅋ,정도현,2022-02-06T03:53:23Z,0,main-comment
611,이프로는 하승진이 전부 캐리하네 안일권이 조금 아쉽다 당근 좀비는 있는거 자체로 존재감이고,Gochozang Chigae,2022-02-06T13:46:32Z,0,main-comment
612,양아치들 말끊으면서 말대답하는거 띠꺼웠는데 속시원하내,한제임스,2022-02-06T17:14:47Z,1,main-comment
613,이 프로… 왠지 대박날 것 같은데!!,Huckleberry H,2022-02-05T11:01:08Z,0,main-comment
614,진짜 정찬성 안일권 저 두분은 파이터들 찾아다니실때 얼마나 재밌을까......최정상의 위치에서 내려다보는것만큼 재밌는게 없을텐데,caio.knight,2022-02-03T09:55:22Z,585,main-comment
615,근데 솔직히 아무리 일반인들이 잘친다고<br>해도 아마 1년차 복서한테는<br>30초 게임 임 <br>그리고 프로는 말 그대로<br>유치원생과 어른과의<br>전력임 <br>그리고 일반인들중<br>잘치는애들은 프로급은<br>안되도 아마급에서 엘리트<br>운동한 애들임 잘치는것임,smg,2022-02-06T08:01:49Z,0,main-comment
616,성명준 참교육 시급합니다,윤가민,2022-02-05T11:58:46Z,1,main-comment
617,우울할때보면 급반전됨,우리동네대표,2022-02-06T14:51:35Z,0,main-comment
618,어디서 길거리 싸움잘한다해도 운동배운사람들앞에선 평등하다,정석철,2022-02-05T16:05:02Z,1,main-comment
619,그와중에 일권이형 도전자 태도 보고 진짜 경험없는 사람인거 알고 혼내주려는거 레전드 ㅋㅋ,겨울바람,2022-02-04T09:36:15Z,122,main-comment
620,1차 검증이 있어야될듯. 넘 양아치들이 나오네,홍홍길동,2022-02-05T16:03:06Z,0,main-comment
621,일권형 멋찌네<br>살짝 올라오셨는데 잘 참으심<br>근데 교육좀 해줬으면 더 비참하게 만들수 있는건데 아쉽네요,두발단속스님,2022-02-06T18:09:03Z,0,main-comment
622,다 제쳐두고 체급이나 맞춥시다 문호씨 은가누랑 마짱뜨면 좋아할거같음?,킴연탄,2022-02-07T08:09:02Z,0,main-comment
623,"<a href=""https://www.youtube.com/watch?v=hRPqJfo483c&amp;t=26m15s"">26:15</a> ㅋㅋㅋㅋㅋㅋㅋㅋ",김효원,2022-02-05T17:58:26Z,0,main-comment
624,진짜 재밌다 30분이 5분같네 ㅎ 컨텐츠 너무좋다 이거보고 본능이 되살아나서 글러브를 다시꺼내서 아들이랑 스파링하고 싶은 욕망이 마구마구 솟구치네요 ㅎ,물리면죽는다,2022-02-03T11:49:46Z,48,main-comment
625,아들 : 아빠 계속 할 수 있겠어?,신촌의고요한영혼,2022-02-03T13:35:06Z,1,reply-comment
626,컨텐츠 지리네,투버유,2022-02-07T06:46:49Z,0,main-comment
627,참교육 프로그램 완전 꿀잼각~~!!!!!,Y.J Cho,2022-02-05T07:02:30Z,0,main-comment
628,하승진은 진짜 피지컬이넘사라 저렇게꼽줘도 한마디도못하네ㅋㅋㅋ,사스가,2022-02-05T11:51:59Z,3,main-comment
629,20초 했을때부터 이미 결과 나온 것 같던데 끝까지 욕하면서 .. 1분 지나니까 겁에 질려있던 것 같았는데 ㅠㅠ 문호님 그래도 참가자라고 잘 참으셨다,찌리,2022-02-06T03:04:09Z,0,main-comment
630,승진이형 팩폭이 이 프로그램의 중요 재미요소 중 하나넼ㅋ,김성태,2022-02-04T11:06:30Z,181,main-comment
631,저건 캡짱 삼류양아치라기 보다는 대화할때 정신병있어보이는데요 ..진짜 쌈좀하는사람이 아니라 그냥 정신병자를 데리고 온듯싶어요ㅜ,성진철,2022-02-05T16:06:31Z,0,main-comment
632,"<a href=""https://www.youtube.com/watch?v=hRPqJfo483c&amp;t=14m30s"">14:30</a> 이거 뭐야.... 코리안조커야 뭐야... 개무섭네",박세빈,2022-02-05T16:43:23Z,0,main-comment
633,13번님이랑 붙으면 재밌을거같아요,충멍이와 초롱이,2022-02-07T00:34:44Z,0,main-comment
634,아직 젊은데 범죄전과를 훈장처럼 자신있게 말하는게 좀 안타깝긴하네..,Star Kevin,2022-02-05T22:46:59Z,1,main-comment
635,진짜 잘만들었다 기획하신분 칭찬해,조형준,2022-02-04T03:19:35Z,53,main-comment
636,왜⸌◦̈⃝⸍ʷʰʸ 안맞지ㅋㅋㅋㅋ? 개웃기네ㅋㅋㅋ,딸기맛,2022-02-06T16:33:05Z,0,main-comment
637,아가리 파이터들 많네요 ㅋㅋㅋㅋㅋㅋ너부웃긴데 게콘보다잼잇어요,c sl,2022-02-06T12:17:40Z,1,main-comment
638,저런것들은 참교육이 필요함,수구리,2022-02-05T10:42:02Z,0,main-comment
639,하승진님이 기 죽이는 멘트가 대박이네 ㅋㅋㅋ 안일권 형님처럼 말만 가오가 아니라 덩치빨이 있으니까 도전자들이 기가 죽음 ㅋㅋㅋㅋ 개쩐다,리코더삼바,2022-02-03T12:50:45Z,98,main-comment
640,격투기랑 싸움이 같나 싸움은 집어던지고 주변에서말리고 특수한 상황들이많으니깐  약한애들때리면서 격투를 잘한다고 착각하는것같다,C이시우,2022-02-07T03:58:59Z,0,main-comment
641,너무 아파하는데<br>억까로 안아프다고 하는거 보면<br>그거에도 쫄 정도로 약한 상대에게만 시비를 걸었나보네<br>상대가 약해서가 아니라 성인이라 깽값 무서워서 라는 생각을 해보시길,iron golem,2022-02-05T06:51:35Z,0,main-comment
642,진또배기를 찾으려면 교도소를가야지 왜 사회에서 찾누,비둘기,2022-02-06T05:21:15Z,1,main-comment
643,전국구 양아치들 합법적으로 참교육가자..,날아라핸섬규,2022-02-07T09:29:19Z,0,main-comment
644,코뚱잉 이런사람들 나오면 ㄷㄷ,익명,2022-02-06T13:55:43Z,1,main-comment
645,사람들마다 철드는시기가 다르긴한데 누군20살에 일찍 정신차리고 누군30살 보통30대초중반안으로 정신들 차리는데 쟤는 과연 언제 정신차릴까 저런애가 이제 커서 단소살인마 공항도둑 되는거거든,김바키,2022-02-06T12:37:48Z,0,main-comment
646,나중에 짜장면 배달이나 와라 우리집에 ㅋㅋㅋㅋ,여유,2022-02-07T08:48:12Z,1,main-comment
647,전치7주를 만들었는데 어떻게 구속이안돼고 저렇게 돌아다니지,이영희,2022-02-05T21:09:49Z,0,main-comment
648,처음에 승진이형이랑 일권이형 살짝 빡쳐서 긴장하고 봤다가 스파링시작하고 3초만에 개그콘서트됨 ㅋㅋㅋㅋㅋㅋㅋㅋㅋㅋㅋ,에어맨,2022-02-03T11:11:43Z,308,main-comment
649,귀엽다ㅋㅋ,조물,2022-02-06T14:24:21Z,0,main-comment
650,파이터가 봐주는게 다보이는데 저렇게 ㅋㅋㅋㅋㅋ,77ᅥ억,2022-02-05T14:34:21Z,0,main-comment
651,ㅋㅋㅋㅋㅋ유쾌 통쾌 상쾌~~~,지누몬,2022-02-05T17:20:29Z,0,main-comment
652,"저아이한텐 그게 최선의선택이 아니었을까..잘못된선택이고 피해받은 사람들이 분명히 있겠지만 자신의 보호막이었던거 같네요. 어떠한 계기가 있었을수도 있고 사정이 있었을수도 있고, 어떠한사건의 가해자일수도 있지만 화면에 보이는 그 마지막 당신의 모습이 꾸준히 유지되길 바라며..",마마승우,2022-02-05T18:50:03Z,4,main-comment
653,찬성이형님은 ㅋㅋㅋㅋㅋㅋㅋㅋㅋㅋㅋㅋㅋㅋㅋㅋㅋㅋㅋㅋ진짜 강한데 ㅋㅋㅋㅋㅋ보고 웃음만 나오시는 상황이시네 ㅋㅋ,JAMES,2022-02-04T12:01:02Z,26,main-comment
654,하승진 화이팅!! ㅋㅋㄱㅋㅋ,kick fast,2022-02-06T05:11:24Z,0,main-comment
655,다음참가자 평택 영철? 나는쏠로 나온 그 영철이네ㅋㅋㅋㅋㅋㅋㅋㅋㅋㅋ,SS S,2022-02-06T12:20:52Z,1,main-comment
656,정찬성선수가웃어주면서  대화해주니까 사람쉬워보이낭?ㅋㅋ 화나면 그림자도못쳐다본다 ㅋㅋ,킹루키,2022-02-05T19:25:56Z,1,main-comment
657,이게 취지가 쌈좀하는애들이 병진이라는건 보여주는 프로그램이네 ㅋㅋㅋㅋㅋㅋㅋ,트리니다드,2022-02-06T21:26:10Z,0,main-comment
658,문호님이 100에서 20도 안쓴거 같은데 진짜 쫄아서 뒷걸음질 치는거 개욱기네 ㅋㅋㅋㅋㅋㅋㅋㅋ,꽃게랑,2022-02-03T16:18:00Z,73,main-comment
659,개꿀잼!!!,Jidee W,2022-02-05T12:57:50Z,0,main-comment
660,사람 안변한다. 그냥 불구를 만들어버리지.<br>전과20범인데 엘리트 코스? ㅋㅋㅋㅋ 말이안나오네. 저거 또 범죄저지를 꺼아니야. 다른 사람한테 또 피눈물 흐르게할거 생각하면<br>....,꽁쓰,2022-02-06T20:35:15Z,1,main-comment
661,진또배긴 마지막에나왔네...머찌다 마인드,ment developpe,2022-02-06T11:18:18Z,0,main-comment
662,대부분 자기가 싸움을 잘한다고 생각하는 부류들의 리얼모습! 실제로 일대일로 저런식의 싸움이 되면 엉망진창 허우적 됩니다. 본인이 싸움을 잘했던게 아니고 현실에서 싸움은 자웅을 겨루는게 아닌 방심한 상대에게나 싸울의사가없는 상대를 기습 급습을 잘했던거뿐이죠! 그것을 싸움잘한다 생각하는 부류가 대부분,sang jin,2022-02-06T00:53:43Z,0,main-comment
663,I hope they find a real Korean gangster and assess their level of fighting.  This is a legit Netflix type of entertainment!,Fishing Tackle Channel,2022-02-03T22:22:41Z,7,main-comment
664,일권이형 존멋!,KOREAWOLFKING,2022-02-05T08:52:47Z,0,main-comment
665,항상 겸손해야 합니다 세상 무서워요,O뎅,2022-02-05T09:50:26Z,1,main-comment
666,넘 머쉬써 이것이야 말로 참교육,리시안셔스,2022-02-06T11:00:09Z,0,main-comment
667,그냥 대놓고 쌩양아치 패주는 거네👍👍,민경일,2022-02-07T04:11:45Z,0,main-comment
668,프로선수가 봐주면서도 하는데도 망가지는걸 보니깐 불쌍하다 그와중에 욕하면서 허세 부리는데 더 불쌍해보이고...,한상우,2022-02-06T21:03:38Z,1,main-comment
669,세상은 넓고 고수는 많다...우물안 개구리,신바람,2022-02-07T06:49:48Z,0,main-comment
670,양아치 참교육 좋다!!!!,한현우,2022-02-05T17:37:45Z,1,main-comment
671,와 이거 개 꿀잼이다 ㅋㅋㅋㅋㅋㅋㅋㅋㅋㅋ 하하하하하하하하하하하하하하하하하하하하하하,돌맹이,2022-02-07T06:25:16Z,0,main-comment
672,아니 나 문호형 입덕해버림....,JR J,2022-02-05T17:32:15Z,0,main-comment
673,솔직히 파이터분이 양아치상대로 주먹말고 발까지 제대로 썼으면 이미 턱 돌이 됐을듯 젊은친구들아 제발 객기부리며 살지마라 세상 넓고 날고기는 사람들 많아..  주먹질해봐야 남는건 니들전과랑 늙어서 아픈몸밖에 없어,샷킬오닐,2022-02-06T15:34:42Z,0,main-comment
674,정의의 배트맨 정찬성 학폭 끝내기 검찰과 경찰이 후원해야 합니다~~!,solvid kim,2022-02-05T12:15:40Z,0,main-comment
675,진짜 학창시절 날리던 쌘놈들 안나온다,용용,2022-02-06T11:49:57Z,1,main-comment
676,"사실 엄청 봐준 게임이었음.<br>일반인들은 로우킥 연타로 2대만 맞아도 못일어나는데, 무기력함을 느끼게해줌으로써 세상은 넓고 강자는 많다는걸 알게해주려는 의도가 보이네요.",TBCC,2022-02-03T13:46:00Z,123,main-comment
677,스타일이 mma 보다 악바리로 싸우기 싫은데 시비걸어서 억지로 싸우는 느낌이네요.,손수민,2022-02-06T11:45:12Z,1,main-comment
678,개재밌다 미쳤다리,크에휴,2022-02-05T17:11:31Z,0,main-comment
679,그나마 기본 검증은 된 사람을 데려와야.........바디 타격 마시지가 많이 아픈가봐요,슬로우&스테디,2022-02-05T11:16:11Z,0,main-comment
680,존나불쌍하게쳐맞네ㅋㅋㅋㅋㅋㅋ<br>길거리쌈도못하겟구먼ㅋㅋㅋ뭔자신감이짘,원할머니보고쌈,2022-02-06T14:21:19Z,0,main-comment
681,문호님 진짜 얼굴만 봐도 지릴 정도로 무섭다,hyuk,2022-02-03T10:33:48Z,216,main-comment
682,"요즘 일진들도 운동 배우는 애들도 많던데,<br>이 정도로 유명했다느니 허세같기도...<br><br>무기 든 거 제외하고, 맨주먹끼리면 우리 체육관 애들한테도 발리겠는데?ㄷㄷ",박돈,2022-02-07T02:00:20Z,0,main-comment
683,길가다  이유없이 왜쳐다보냐 시비거는  가오잡이 잼민이들에게 필요한영상!!!,chung lee,2022-02-07T07:01:20Z,0,main-comment
684,이게 일반인과 프로의 차이지....문호가 50프로만 썻어도....병워가서 반성할듯...,역풍,2022-02-05T16:57:16Z,0,main-comment
685,"<a href=""https://www.youtube.com/watch?v=hRPqJfo483c&amp;t=15m05s"">15:05</a> 에 출소한 날 말해놓곸ㅋㅋ 퇴원한 날...? 이건 뭐지..",도른아곰,2022-02-05T22:10:51Z,0,main-comment
686,"범죄자를 옹호하는 건 아니지만, 확실히 캐릭터있고 재밌네요 ㅋㅋㅋㅋ 섭외 어떻게 하시는거죠 계속? 앞으로 본인이 마지막에 한 말처럼 갱생하길",Kokoka,2022-02-03T10:45:44Z,169,main-comment
687,그냥 이거는 파이터 찾는게 아니라 양아치들 참교육프로그램이네ㅋㅋㅋㅋㅋㅋㅋㅋㅋㅋㅋㅋㅋ,대한보틀,2022-02-05T11:07:37Z,1,main-comment
